web_url,snippet,source,keywords,pub_date,word_count,headline.main,headline.kicker,headline.content_kicker,headline.print_headline,headline.name,headline.seo,headline.sub,byline.original,byline.organization,title,page,results,total_pages,total_results,genres,spoken_languages,production_countries
https://www.nytimes.com/2020/10/15/movies/love-and-monsters-review.html,The new sci-fi adventure from Michael Matthews lacks the self-seriousness of typical dystopian flicks but doesn’t completely lack depth.,The New York Times,"[{""name"": ""persons"", ""value"": ""Matthews, Michael (Film Director)"", ""rank"": 1, ""major"": ""N""}, {""name"": ""subject"", ""value"": ""Movies"", ""rank"": 2, ""major"": ""N""}, {""name"": ""creative_works"", ""value"": ""Love and Monsters (Movie)"", ""rank"": 3, ""major"": ""N""}]",2020-10-15T11:00:07+0000,284.0,‘Love and Monsters’ Review: Coming-of-Age After the Apocalypse,,,Love and Monsters,,,,By Lovia Gyarkye,,‘Love and Monsters’ Review,,,,,nan,nan,nan
https://www.nytimes.com/2020/10/01/movies/dick-johnson-is-dead-review.html,"With the help of her father, the documentary filmmaker Kirsten Johnson made a surprising, endearing movie about his death.",The New York Times,"[{""name"": ""creative_works"", ""value"": ""Dick Johnson Is Dead (Movie)"", ""rank"": 1, ""major"": ""N""}, {""name"": ""subject"", ""value"": ""Documentary Films and Programs"", ""rank"": 2, ""major"": ""N""}, {""name"": ""persons"", ""value"": ""Johnson, Kirsten (1965- )"", ""rank"": 3, ""major"": ""N""}, {""name"": ""creative_works"", ""value"": ""Cameraperson (Movie)"", ""rank"": 4, ""major"": ""N""}, {""name"": ""subject"", ""value"": ""Death and Dying"", ""rank"": 5, ""major"": ""N""}]",2020-10-01T11:00:08+0000,816.0,"‘Dick Johnson Is Dead’ Review: A Father’s Painful, Funny Goodbye",Critic’s pick,,A Love Letter Delivered Along With a Death Notice,,,,By Manohla Dargis,,‘Dick Johnson Is Dead’ Review,,,,,nan,nan,nan
https://www.nytimes.com/2020/09/03/movies/love-guaranteed-review-swiping-left-on-online-dating.html,Rachael Leigh Cook stars in this rom-com about a lawyer and her charming new client who wants to sue a dating website for falsely promising love.,The New York Times,"[{""name"": ""subject"", ""value"": ""Movies"", ""rank"": 1, ""major"": ""N""}, {""name"": ""persons"", ""value"": ""Cook, Rachael Leigh"", ""rank"": 2, ""major"": ""N""}, {""name"": ""persons"", ""value"": ""Wayans, Damon Jr"", ""rank"": 3, ""major"": ""N""}, {""name"": ""persons"", ""value"": ""Johnson, Mark Steven"", ""rank"": 4, ""major"": ""N""}, {""name"": ""creative_works"", ""value"": ""Love, Guaranteed (Movie)"", ""rank"": 5, ""major"": ""N""}]",2020-09-03T07:01:05+0000,343.0,"‘Love, Guaranteed’ Review: Swiping Left on Online Dating",,,"Love, Guaranteed",,,,By Natalia Winkelman,,"‘Love, Guaranteed’ Review",,,,,nan,nan,nan
https://www.nytimes.com/2020/06/19/movies/feel-the-beat-review.html,A prickly professional dancer becomes a reluctant instructor for a preteen dance troupe in this formulaic dramedy.,The New York Times,"[{""name"": ""subject"", ""value"": ""Movies"", ""rank"": 1, ""major"": ""N""}, {""name"": ""persons"", ""value"": ""Carson, Sofia (1993- )"", ""rank"": 2, ""major"": ""N""}, {""name"": ""persons"", ""value"": ""Down, Elissa (1975- )"", ""rank"": 3, ""major"": ""N""}, {""name"": ""creative_works"", ""value"": ""Feel the Beat (Movie)"", ""rank"": 4, ""major"": ""N""}]",2020-06-19T07:01:02+0000,253.0,‘Feel the Beat’ Review: Tough Love in the Dance Studio,,,A Young Troupe Needs Some Ballet Tough Love,,,,By Natalia Winkelman,,‘Feel the Beat’ Review,,,,,nan,nan,nan
https://www.nytimes.com/2020/06/18/movies/babyteeth-review.html,"Eliza Scanlen plays a seriously ill high schooler who falls for the wrong guy who turns out to have the right stuff, after all.",The New York Times,"[{""name"": ""subject"", ""value"": ""Movies"", ""rank"": 1, ""major"": ""N""}, {""name"": ""creative_works"", ""value"": ""Babyteeth (Movie)"", ""rank"": 2, ""major"": ""N""}, {""name"": ""persons"", ""value"": ""Murphy, Shannon (Film Director)"", ""rank"": 3, ""major"": ""N""}, {""name"": ""persons"", ""value"": ""Scanlen, Eliza"", ""rank"": 4, ""major"": ""N""}, {""name"": ""persons"", ""value"": ""Wallace, Toby (1996- )"", ""rank"": 5, ""major"": ""N""}]",2020-06-18T16:31:36+0000,517.0,"‘Babyteeth’ Review: Love Means Never Having, Well, You Know",,,"Love Means Never Having, Well, You Know",,,,By Manohla Dargis,,‘Babyteeth’ Review,,,,,nan,nan,nan
https://www.nytimes.com/2020/06/03/movies/spelling-the-dream-review.html,"This Netflix documentary explores the unbroken Indian-American dominance of the U.S. national spelling bee, to less than winning results.",The New York Times,"[{""name"": ""subject"", ""value"": ""Documentary Films and Programs"", ""rank"": 1, ""major"": ""N""}, {""name"": ""subject"", ""value"": ""Scripps National Spelling Bee"", ""rank"": 2, ""major"": ""N""}, {""name"": ""persons"", ""value"": ""Rega, Sam"", ""rank"": 3, ""major"": ""N""}, {""name"": ""creative_works"", ""value"": ""Spelling the Dream (Movie)"", ""rank"": 4, ""major"": ""N""}, {""name"": ""subject"", ""value"": ""Spelling"", ""rank"": 5, ""major"": ""N""}, {""name"": ""organizations"", ""value"": ""Netflix Inc"", ""rank"": 6, ""major"": ""N""}]",2020-06-03T12:44:10+0000,296.0,‘Spelling the Dream’ Review: Words of Inspiration,,,Love of Language Spells Success,,,,By Bilal Qureshi,,‘Spelling the Dream’ Review,,,,,nan,nan,nan
https://www.nytimes.com/2020/04/29/movies/a-secret-love-review.html,"This tender film explores the partnership between two women who lived, in public and to kin, as dear friends for six decades.",The New York Times,"[{""name"": ""subject"", ""value"": ""Documentary Films and Programs"", ""rank"": 1, ""major"": ""N""}, {""name"": ""subject"", ""value"": ""Homosexuality and Bisexuality"", ""rank"": 2, ""major"": ""N""}, {""name"": ""persons"", ""value"": ""Bolan, Chris (Filmmaker)"", ""rank"": 3, ""major"": ""N""}, {""name"": ""creative_works"", ""value"": ""A Secret Love (Movie)"", ""rank"": 4, ""major"": ""N""}]",2020-04-29T07:01:02+0000,309.0,‘A Secret Love’ Review: A Lesbian Couple’s Enduring Affection,,,Making a Haven of Their Own,,,,By Natalia Winkelman,,‘A Secret Love’ Review,,,,,nan,nan,nan
https://www.nytimes.com/2020/04/10/movies/love-wedding-repeat-review-a-tumble-down-the-aisle.html,A couple’s reception becomes a disaster (or does it?) in this comedy of multiple errors.,The New York Times,"[{""name"": ""subject"", ""value"": ""Movies"", ""rank"": 1, ""major"": ""N""}, {""name"": ""creative_works"", ""value"": ""Love Wedding Repeat (Movie)"", ""rank"": 2, ""major"": ""N""}, {""name"": ""persons"", ""value"": ""Craig, Dean (1974- )"", ""rank"": 3, ""major"": ""N""}, {""name"": ""persons"", ""value"": ""Claflin, Sam"", ""rank"": 4, ""major"": ""N""}, {""name"": ""persons"", ""value"": ""Munn, Olivia"", ""rank"": 5, ""major"": ""N""}]",2020-04-10T07:01:05+0000,414.0,‘Love Wedding Repeat’ Review: A Tumble Down the Aisle,Movie Review,,Pratfalling Down The Aisle,,,,By Amy Nicholson,,‘Love Wedding Repeat’ Review,,,,,nan,nan,nan
https://www.nytimes.com/2020/04/02/movies/almost-love-review.html,This ensemble comedy treats class solidarity as the love that dare not speak its name.,The New York Times,"[{""name"": ""subject"", ""value"": ""Movies"", ""rank"": 1, ""major"": ""N""}, {""name"": ""creative_works"", ""value"": ""Almost Love (Movie)"", ""rank"": 2, ""major"": ""N""}, {""name"": ""persons"", ""value"": ""Doyle, Mike (1972- )"", ""rank"": 3, ""major"": ""N""}]",2020-04-02T11:00:03+0000,408.0,"‘Almost Love’ Review: Schooled in Romance, but Missing Class",,,"Schooled in Romance, but Missing Class",,,,By Teo Bugbee,,‘Almost Love’ Review,,,,,nan,nan,nan
https://www.nytimes.com/2020/03/05/movies/hope-gap-review-a-thin-line-between-love-and-war.html,Annette Bening and Bill Nighy play a couple that has lost its way after 29 years of marriage.,The New York Times,"[{""name"": ""subject"", ""value"": ""Movies"", ""rank"": 1, ""major"": ""N""}, {""name"": ""persons"", ""value"": ""Bening, Annette"", ""rank"": 2, ""major"": ""N""}, {""name"": ""persons"", ""value"": ""Nighy, Bill"", ""rank"": 3, ""major"": ""N""}, {""name"": ""persons"", ""value"": ""Nicholson, William (1948- )"", ""rank"": 4, ""major"": ""N""}, {""name"": ""creative_works"", ""value"": ""Hope Gap (Movie)"", ""rank"": 5, ""major"": ""N""}]",2020-03-05T12:00:03+0000,257.0,‘Hope Gap’ Review: A Thin Line Between Love and War,,,Hope Gap,,,,By Aisha Harris,,‘Hope Gap’ Review,,,,,nan,nan,nan
https://www.nytimes.com/2020/02/28/movies/all-the-bright-places-review.html,Elle Fanning and Justice Smith breathe life into a film about mental illness and the healing power of love.,The New York Times,"[{""name"": ""subject"", ""value"": ""Movies"", ""rank"": 1, ""major"": ""N""}, {""name"": ""creative_works"", ""value"": ""All the Bright Places (Movie)"", ""rank"": 2, ""major"": ""N""}, {""name"": ""persons"", ""value"": ""Haley, Brett"", ""rank"": 3, ""major"": ""N""}, {""name"": ""persons"", ""value"": ""Fanning, Elle"", ""rank"": 4, ""major"": ""N""}, {""name"": ""persons"", ""value"": ""Smith, Justice (1995- )"", ""rank"": 5, ""major"": ""N""}, {""name"": ""organizations"", ""value"": ""Netflix Inc"", ""rank"": 6, ""major"": ""N""}]",2020-02-28T08:01:07+0000,233.0,‘All the Bright Places’ Review: Love Amid Trauma,Streaming Movie Review,,A Refreshing Exploration of Mental Illness,,,,By Candice Frederick,,‘All the Bright Places’ Review,,,,,nan,nan,nan
https://www.nytimes.com/2020/02/13/movies/the-photograph-review.html,Issa Rae and a terrific Lakeith Stanfield play a New York couple whose romance sends them and the story into the past.,The New York Times,"[{""name"": ""subject"", ""value"": ""Movies"", ""rank"": 1, ""major"": ""N""}, {""name"": ""creative_works"", ""value"": ""The Photograph (Movie)"", ""rank"": 2, ""major"": ""N""}, {""name"": ""persons"", ""value"": ""Meghie, Stella"", ""rank"": 3, ""major"": ""N""}, {""name"": ""persons"", ""value"": ""Rae, Issa"", ""rank"": 4, ""major"": ""N""}, {""name"": ""persons"", ""value"": ""Stanfield, Lakeith"", ""rank"": 5, ""major"": ""N""}]",2020-02-13T20:54:33+0000,862.0,‘The Photograph’ Review: An Unabashedly Old-School Love Story,,,An Unabashedly Old-School Love Story,,,,By Manohla Dargis,,‘The Photograph’ Review,,,,,nan,nan,nan
https://www.nytimes.com/2020/02/13/movies/you-go-to-my-head-review.html,A mysterious architect persuades an amnesiac that she’s his wife in this elusive romance set in the Sahara.,The New York Times,"[{""name"": ""subject"", ""value"": ""Movies"", ""rank"": 1, ""major"": ""N""}, {""name"": ""creative_works"", ""value"": ""You Go to My Head (Movie)"", ""rank"": 2, ""major"": ""N""}, {""name"": ""persons"", ""value"": ""de Clercq, Dimitri"", ""rank"": 3, ""major"": ""N""}]",2020-02-13T12:00:05+0000,292.0,‘You Go to My Head’ Review: Untrue Love,Critic’s Pick,,Designing a Love Story,,,,By Jeannette Catsoulis,,‘You Go to My Head’ Review,,,,,nan,nan,nan
https://www.nytimes.com/2020/02/12/movies/ordinary-love-review.html,Lesley Manville and Liam Neeson play a married couple facing a cancer diagnosis.,The New York Times,"[{""name"": ""subject"", ""value"": ""Movies"", ""rank"": 1, ""major"": ""N""}, {""name"": ""creative_works"", ""value"": ""Ordinary Love (Movie)"", ""rank"": 2, ""major"": ""N""}, {""name"": ""persons"", ""value"": ""Neeson, Liam"", ""rank"": 3, ""major"": ""N""}, {""name"": ""persons"", ""value"": ""Manville, Lesley"", ""rank"": 4, ""major"": ""N""}, {""name"": ""persons"", ""value"": ""D'Sa, Lisa Barros"", ""rank"": 5, ""major"": ""N""}, {""name"": ""persons"", ""value"": ""Leyburn, Glenn"", ""rank"": 6, ""major"": ""N""}]",2020-02-12T19:46:45+0000,569.0,‘Ordinary Love’ Review: In Sickness and in Health,,,Old-Sweater Lives,,,,By A.O. Scott,,‘Ordinary Love’ Review,,,,,nan,nan,nan
https://www.nytimes.com/2020/01/09/movies/the-woman-who-loves-giraffes-review.html,"This warm documentary uses one woman’s singular passion to fuel a tale of zoological discovery, blatant sexism and environmental alarm.",The New York Times,"[{""name"": ""subject"", ""value"": ""Documentary Films and Programs"", ""rank"": 1, ""major"": ""N""}, {""name"": ""subject"", ""value"": ""Giraffes"", ""rank"": 2, ""major"": ""N""}, {""name"": ""creative_works"", ""value"": ""The Woman Who Loves Giraffes (Movie)"", ""rank"": 3, ""major"": ""N""}, {""name"": ""persons"", ""value"": ""Dagg, Anne Innis"", ""rank"": 4, ""major"": ""N""}, {""name"": ""persons"", ""value"": ""Reid, Alison (Filmmaker)"", ""rank"": 5, ""major"": ""N""}]",2020-01-09T12:00:04+0000,279.0,‘The Woman Who Loves Giraffes’ Review: Crackers for Animals,,,A Special Spot  In Her Heart,,,,By Jeannette Catsoulis,,‘The Woman Who Loves Giraffes’ Review,,,,,nan,nan,nan
https://www.nytimes.com/2019/11/26/movies/queen-and-slim-review.html,Daniel Kaluuya and Jodie Turner-Smith star in Melina Matsoukas’s dreamy but intense outlaw romance.,The New York Times,"[{""name"": ""subject"", ""value"": ""Movies"", ""rank"": 1, ""major"": ""N""}, {""name"": ""creative_works"", ""value"": ""Queen & Slim (Movie)"", ""rank"": 2, ""major"": ""N""}, {""name"": ""persons"", ""value"": ""Matsoukas, Melina"", ""rank"": 3, ""major"": ""N""}, {""name"": ""persons"", ""value"": ""Waithe, Lena"", ""rank"": 4, ""major"": ""N""}, {""name"": ""persons"", ""value"": ""Kaluuya, Daniel"", ""rank"": 5, ""major"": ""N""}, {""name"": ""persons"", ""value"": ""Turner-Smith, Jodie"", ""rank"": 6, ""major"": ""N""}]",2019-11-26T17:41:50+0000,799.0,‘Queen & Slim’ Review: Love on the Run,critic’s pick,,Love Simmers Inside a Cauldron,,,,By A.O. Scott,,‘Queen & Slim’ Review,,,,,nan,nan,nan
https://www.nytimes.com/2019/11/05/movies/marriage-story-review.html,"Adam Driver and Scarlett Johansson self-consciously uncouple in Noah Baumbach’s tender, stinging tale of divorce.",The New York Times,"[{""name"": ""subject"", ""value"": ""Movies"", ""rank"": 1, ""major"": ""N""}, {""name"": ""persons"", ""value"": ""Baumbach, Noah"", ""rank"": 2, ""major"": ""N""}, {""name"": ""creative_works"", ""value"": ""Marriage Story (Movie)"", ""rank"": 3, ""major"": ""N""}, {""name"": ""persons"", ""value"": ""Driver, Adam"", ""rank"": 4, ""major"": ""N""}, {""name"": ""persons"", ""value"": ""Johansson, Scarlett"", ""rank"": 5, ""major"": ""N""}, {""name"": ""persons"", ""value"": ""ALDA, ALAN"", ""rank"": 6, ""major"": ""N""}, {""name"": ""persons"", ""value"": ""Dern, Laura"", ""rank"": 7, ""major"": ""N""}, {""name"": ""persons"", ""value"": ""Liotta, Ray"", ""rank"": 8, ""major"": ""N""}]",2019-11-05T19:01:02+0000,1244.0,‘Marriage Story’ Review: Dance Me to the End of Love,critic’s pick,,"Friendly Split, Shattering Break",,,,By A.O. Scott,,‘Marriage Story’ Review,,,,,nan,nan,nan
https://www.nytimes.com/2019/10/17/movies/cyrano-my-love-review.html,This superficial take on the writing and initial staging of “Cyrano de Bergerac” is a whirlwind of soapy declarations and backstage chaos.,The New York Times,"[{""name"": ""subject"", ""value"": ""Movies"", ""rank"": 1, ""major"": ""N""}, {""name"": ""creative_works"", ""value"": ""Cyrano, My Love (Movie)"", ""rank"": 2, ""major"": ""N""}, {""name"": ""persons"", ""value"": ""Michalik, Alexis"", ""rank"": 3, ""major"": ""N""}]",2019-10-17T11:00:03+0000,291.0,"‘Cyrano, My Love’ Review: A Nose for Romance",,,"Cyrano, My Love",,,,By Jeannette Catsoulis,,"‘Cyrano, My Love’ Review",,,,,nan,nan,nan
https://www.nytimes.com/2019/10/03/movies/pretenders-review.html,"Directed by James Franco and featuring James Franco, this film indulges in a distasteful brand of nostalgia.",The New York Times,"[{""name"": ""subject"", ""value"": ""Movies"", ""rank"": 1, ""major"": ""N""}, {""name"": ""persons"", ""value"": ""Franco, James"", ""rank"": 2, ""major"": ""N""}, {""name"": ""creative_works"", ""value"": ""Pretenders (Movie)"", ""rank"": 3, ""major"": ""N""}]",2019-10-03T11:00:07+0000,276.0,"‘Pretenders’ Review: A Little New Wave Love, a Lot of Misogyny",,,Pretenders,,,,By Glenn Kenny,,‘Pretenders’ Review,,,,,nan,nan,nan
https://www.nytimes.com/2019/09/26/movies/first-love-review.html,The prolific director Takashi Miike delivers an unusually satisfying Japanese genre romp.,The New York Times,"[{""name"": ""subject"", ""value"": ""Movies"", ""rank"": 1, ""major"": ""N""}, {""name"": ""persons"", ""value"": ""Miike, Takashi"", ""rank"": 2, ""major"": ""N""}, {""name"": ""creative_works"", ""value"": ""First Love (Movie)"", ""rank"": 3, ""major"": ""N""}]",2019-09-26T11:00:06+0000,398.0,‘First Love’ Review: Eluding Assassins With the Help of a Boxer,Critic’s Pick,,"Assassin Variations, by Way of Japan",,,,By Glenn Kenny,,‘First Love’ Review,,,,,nan,nan,nan
https://www.nytimes.com/2019/09/19/movies/loro-review.html,Toni Servillo plays the former Italian Prime Minister Silvio Berlusconi in Paolo Sorrentino’s extravagant portrait.,The New York Times,"[{""name"": ""subject"", ""value"": ""Movies"", ""rank"": 1, ""major"": ""N""}, {""name"": ""creative_works"", ""value"": ""Loro (Movie)"", ""rank"": 2, ""major"": ""N""}, {""name"": ""persons"", ""value"": ""Servillo, Toni"", ""rank"": 3, ""major"": ""N""}, {""name"": ""persons"", ""value"": ""Sorrentino, Paolo"", ""rank"": 4, ""major"": ""N""}, {""name"": ""persons"", ""value"": ""Berlusconi, Silvio"", ""rank"": 5, ""major"": ""N""}, {""name"": ""glocations"", ""value"": ""Italy"", ""rank"": 6, ""major"": ""N""}]",2019-09-19T17:27:07+0000,820.0,"‘Loro’ Review: A Corrupt Leader, and the People Who Love Him",,,Corruption and Charisma Personified,,,,By A.O. Scott,,‘Loro’ Review,,,,,nan,nan,nan
https://www.nytimes.com/2019/08/29/movies/falling-inn-love-review.html,"It’s hard to find a reliable, talented, reasonably priced, eco-friendly contractor these days.",The New York Times,"[{""name"": ""subject"", ""value"": ""Movies"", ""rank"": 1, ""major"": ""N""}, {""name"": ""organizations"", ""value"": ""Netflix Inc"", ""rank"": 2, ""major"": ""N""}, {""name"": ""persons"", ""value"": ""Kumble, Roger"", ""rank"": 3, ""major"": ""N""}, {""name"": ""persons"", ""value"": ""Milian, Christina"", ""rank"": 4, ""major"": ""N""}, {""name"": ""persons"", ""value"": ""Demos, Adam"", ""rank"": 5, ""major"": ""N""}, {""name"": ""creative_works"", ""value"": ""Falling Inn Love (Movie)"", ""rank"": 6, ""major"": ""N""}]",2019-08-29T14:56:44+0000,374.0,‘Falling Inn Love’ Review: A Prize That Needs Some Work,Streaming Movie Review,,A Fine Romance to Watch While Sorting Socks,,,,By Helen T. Verongos,,‘Falling Inn Love’ Review,,,,,nan,nan,nan
https://www.nytimes.com/2019/08/22/movies/hot-air-review.html,Steve Coogan stars in this cumbersome political comedy.,The New York Times,"[{""name"": ""subject"", ""value"": ""Movies"", ""rank"": 1, ""major"": ""N""}, {""name"": ""persons"", ""value"": ""Coogan, Steve"", ""rank"": 2, ""major"": ""N""}, {""name"": ""persons"", ""value"": ""Coraci, Frank"", ""rank"": 3, ""major"": ""N""}, {""name"": ""creative_works"", ""value"": ""Hot Air (Movie)"", ""rank"": 4, ""major"": ""N""}, {""name"": ""persons"", ""value"": ""Campbell, Neve"", ""rank"": 5, ""major"": ""N""}]",2019-08-22T15:50:09+0000,266.0,‘Hot Air’ Review: A Right-Wing Radio Host Learns to Love Again,,,Hot Air,,,,By Bilge Ebiri,,‘Hot Air’ Review,,,,,nan,nan,nan
https://www.nytimes.com/2019/08/08/movies/love-anthosa-review.html,"Anton Yelchin, who played Chekov in the J.J. Abrams-produced “Star Trek” films, assembled an eclectic filmography before his death at 27 in 2016.",The New York Times,"[{""name"": ""subject"", ""value"": ""Documentary Films and Programs"", ""rank"": 1, ""major"": ""N""}, {""name"": ""creative_works"", ""value"": ""Love, Antosha (Movie)"", ""rank"": 2, ""major"": ""N""}, {""name"": ""persons"", ""value"": ""Price, Garret"", ""rank"": 3, ""major"": ""N""}, {""name"": ""persons"", ""value"": ""Yelchin, Anton"", ""rank"": 4, ""major"": ""N""}]",2019-08-08T09:00:10+0000,319.0,"‘Love, Antosha’ Review: A Heartbreaking Look at an Actor’s Too-Short Life",Critic’s Pick,,"Love, Antosha",,,,By Glenn Kenny,,"‘Love, Antosha’ Review",,,,,nan,nan,nan
https://www.nytimes.com/2019/06/06/movies/leto-review.html,Kirill Serebrennikov’s gentle mood piece brings an underground music scene to vivid life.,The New York Times,"[{""name"": ""subject"", ""value"": ""Music"", ""rank"": 1, ""major"": ""N""}, {""name"": ""creative_works"", ""value"": ""Leto (Movie)"", ""rank"": 2, ""major"": ""N""}, {""name"": ""persons"", ""value"": ""Serebrennikov, Kirill S"", ""rank"": 3, ""major"": ""N""}]",2019-06-06T11:00:02+0000,283.0,‘Leto’ Review: Love and Rock in Leningrad,Critic’s Pick,,Leto,,,,By Jeannette Catsoulis,,‘Leto’ Review,,,,,nan,nan,nan
https://www.nytimes.com/2019/05/21/movies/the-tomorrow-man-review.html,Blythe Danner and John Lithgow strain to elevate this twee late-life romance.,The New York Times,"[{""name"": ""subject"", ""value"": ""Movies"", ""rank"": 1, ""major"": ""N""}, {""name"": ""creative_works"", ""value"": ""The Tomorrow Man (Movie)"", ""rank"": 2, ""major"": ""N""}, {""name"": ""persons"", ""value"": ""Danner, Blythe"", ""rank"": 3, ""major"": ""N""}, {""name"": ""persons"", ""value"": ""Lithgow, John"", ""rank"": 4, ""major"": ""N""}, {""name"": ""persons"", ""value"": ""Jones, Noble"", ""rank"": 5, ""major"": ""N""}]",2019-05-21T11:00:01+0000,280.0,‘The Tomorrow Man’ Review: Love Among the Neuroses,,,"They Whirl, They Twirl, They Tango",,,,By Jeannette Catsoulis,,‘The Tomorrow Man’ Review,,,,,nan,nan,nan
https://www.nytimes.com/2019/05/16/movies/asako-i-and-ii-review.html,The Japanese director Ryusuke Hamaguchi follows up his marathon “Happy Hour” with a story of love among young urbanites.,The New York Times,"[{""name"": ""subject"", ""value"": ""Movies"", ""rank"": 1, ""major"": ""N""}, {""name"": ""creative_works"", ""value"": ""Asako I & II (Movie)"", ""rank"": 2, ""major"": ""N""}, {""name"": ""persons"", ""value"": ""Hamaguchi, Ryusuke"", ""rank"": 3, ""major"": ""N""}]",2019-05-16T11:00:01+0000,547.0,‘Asako I & II’ Review: Double the Love (and the Heartbreak),Critic’s Pick,,Falling For a Drifter And His Lookalike,,,,By Glenn Kenny,,‘Asako I & II’ Review,,,,,nan,nan,nan
https://www.nytimes.com/2019/05/15/movies/the-sun-is-also-a-star-review.html,"Yara Shahidi and Charles Melton play teenagers falling in love on a hectic, sunny day in New York.",The New York Times,"[{""name"": ""subject"", ""value"": ""Movies"", ""rank"": 1, ""major"": ""N""}, {""name"": ""creative_works"", ""value"": ""The Sun Is also a Star (Movie)"", ""rank"": 2, ""major"": ""N""}, {""name"": ""persons"", ""value"": ""Russo-Young, Ry"", ""rank"": 3, ""major"": ""N""}, {""name"": ""persons"", ""value"": ""Shahidi, Yara (2000- )"", ""rank"": 4, ""major"": ""N""}, {""name"": ""persons"", ""value"": ""Yoon, Nicola (Author)"", ""rank"": 5, ""major"": ""N""}, {""name"": ""persons"", ""value"": ""Melton, Charles (1991- )"", ""rank"": 6, ""major"": ""N""}]",2019-05-15T16:01:27+0000,697.0,"‘The Sun Is Also a Star’ Review: A Charming, if Generic, Adolescent Love Story",,,A Beautiful Day for Young Hearts,,,,By A.O. Scott,,‘The Sun Is Also a Star’ Review,,,,,nan,nan,nan
https://www.nytimes.com/2019/05/10/movies/sheherazade-review.html,The options are few and most of them involve risk or further deprivation for these French teenagers who face the world with little support.,The New York Times,"[{""name"": ""subject"", ""value"": ""Movies"", ""rank"": 1, ""major"": ""N""}, {""name"": ""organizations"", ""value"": ""Netflix Inc"", ""rank"": 2, ""major"": ""N""}, {""name"": ""creative_works"", ""value"": ""Sheherazade (Movie)"", ""rank"": 3, ""major"": ""N""}, {""name"": ""persons"", ""value"": ""Marlin, Jean-Bernard"", ""rank"": 4, ""major"": ""N""}]",2019-05-10T11:00:01+0000,350.0,‘Shéhérazade’ Review: Love in the Mean Streets of Marseille,Streaming Movie Review,,,,,,By Helen T. Verongos,,‘Shéhérazade’ Review,,,,,nan,nan,nan
https://www.nytimes.com/2019/05/02/movies/long-shot-review.html,The improbably yet perfectly paired stars play old friends who unexpectedly find love in this charming (and a bit vulgar) romantic comedy.,The New York Times,"[{""name"": ""subject"", ""value"": ""Movies"", ""rank"": 1, ""major"": ""N""}, {""name"": ""subject"", ""value"": ""Comedy and Humor"", ""rank"": 2, ""major"": ""N""}, {""name"": ""persons"", ""value"": ""Odenkirk, Bob"", ""rank"": 3, ""major"": ""N""}, {""name"": ""persons"", ""value"": ""Rogen, Seth"", ""rank"": 4, ""major"": ""N""}, {""name"": ""persons"", ""value"": ""Theron, Charlize"", ""rank"": 5, ""major"": ""N""}, {""name"": ""creative_works"", ""value"": ""Long Shot (Movie)"", ""rank"": 6, ""major"": ""N""}, {""name"": ""persons"", ""value"": ""Levine, Jonathan A (1976- )"", ""rank"": 7, ""major"": ""N""}]",2019-05-02T17:43:25+0000,1025.0,‘Long Shot’ Review: Charlize Theron and Seth Rogen Give Good Heart,Critic’s Pick,,Beating the Odds for Love and Bliss,,,,By Manohla Dargis,,‘Long Shot’ Review,,,,,nan,nan,nan
