web_url,snippet,source,keywords,pub_date,word_count,headline.main,headline.kicker,headline.content_kicker,headline.print_headline,headline.name,headline.seo,headline.sub,byline.original,byline.organization,title,page,results,total_pages,total_results,genres,spoken_languages,production_countries
https://www.nytimes.com/2023/05/25/movies/the-attachment-diaries-review.html,"A gynecologist and her patient form a horrifyingly twisted connection in this batty, bloody Argentine melodrama.",The New York Times,"[{""name"": ""subject"", ""value"": ""Movies"", ""rank"": 1, ""major"": ""N""}, {""name"": ""creative_works"", ""value"": ""The Attachment Diaries (Movie)"", ""rank"": 2, ""major"": ""N""}, {""name"": ""persons"", ""value"": ""Diment, Valentin Javier"", ""rank"": 3, ""major"": ""N""}]",2023-05-25T11:00:03+0000,295.0,"‘The Attachment Diaries’ Review: Love, Sick",,,The Attachment Diaries,,,,By Jeannette Catsoulis,,‘The Attachment Diaries’ Review,,,,,nan,nan,nan
https://www.nytimes.com/2023/05/04/movies/whats-love-got-to-do-with-it-review.html,Two childhood friends navigate cultural differences in this pleasantly uncontentious romantic comedy.,The New York Times,"[{""name"": ""subject"", ""value"": ""Movies"", ""rank"": 1, ""major"": ""N""}, {""name"": ""persons"", ""value"": ""Kapur, Shekhar"", ""rank"": 2, ""major"": ""N""}, {""name"": ""persons"", ""value"": ""James, Lily"", ""rank"": 3, ""major"": ""N""}, {""name"": ""persons"", ""value"": ""Azmi, Shabana"", ""rank"": 4, ""major"": ""N""}, {""name"": ""persons"", ""value"": ""Thompson, Emma"", ""rank"": 5, ""major"": ""N""}]",2023-05-04T17:16:45+0000,287.0,Review: ‘What’s Love Got to Do With It?’ Probably a Lot,,,What’s Love Got to Do With It?,,,,By Jeannette Catsoulis,,Review,,,,,nan,nan,nan
https://www.nytimes.com/2018/11/01/movies/theyll-love-me-when-im-dead-review-documentary.html,Morgan Neville’s movie tells the tumultuous behind-the-scenes story of the making and near-unmaking of “The Other Side of the Wind.”,The New York Times,"[{""name"": ""subject"", ""value"": ""Documentary Films and Programs"", ""rank"": 1, ""major"": ""N""}, {""name"": ""creative_works"", ""value"": ""They'll Love Me When I'm Dead (Movie)"", ""rank"": 2, ""major"": ""N""}, {""name"": ""persons"", ""value"": ""Neville, Morgan"", ""rank"": 3, ""major"": ""N""}, {""name"": ""creative_works"", ""value"": ""The Other Side of the Wind (Movie)"", ""rank"": 4, ""major"": ""N""}, {""name"": ""persons"", ""value"": ""Welles, Orson"", ""rank"": 5, ""major"": ""N""}]",2018-11-01T13:56:39+0000,794.0,Review: ‘They’ll Love Me When I’m Dead’ Documents Orson Welles’s Last Film,,,The Legend Behind The Scenes,,,,By Manohla Dargis,,Review,,,,,nan,nan,nan
https://www.nytimes.com/2018/10/25/movies/burning-review.html,The great South Korean director Lee Chang-dong’s latest involves three characters subsumed by desire and rage.,The New York Times,"[{""name"": ""subject"", ""value"": ""Movies"", ""rank"": 1, ""major"": ""N""}, {""name"": ""creative_works"", ""value"": ""Burning (Movie)"", ""rank"": 2, ""major"": ""N""}, {""name"": ""persons"", ""value"": ""Lee Chang-dong"", ""rank"": 3, ""major"": ""N""}, {""name"": ""persons"", ""value"": ""Yeun, Steven"", ""rank"": 4, ""major"": ""N""}, {""name"": ""persons"", ""value"": ""Murakami, Haruki"", ""rank"": 5, ""major"": ""N""}]",2018-10-25T17:39:04+0000,949.0,"Review: In ‘Burning,’ Love Ignites a Divided World",,,Love Ignites a Divided World,,,,By Manohla Dargis,,Review,,,,,nan,nan,nan
https://www.nytimes.com/2018/10/11/movies/after-everything-review.html,This cancer drama focuses less on the high stakes of illness than on how two young people talk to each other in sickness and in health.,The New York Times,"[{""name"": ""subject"", ""value"": ""Movies"", ""rank"": 1, ""major"": ""N""}, {""name"": ""creative_works"", ""value"": ""After Everything (Movie)"", ""rank"": 2, ""major"": ""N""}, {""name"": ""persons"", ""value"": ""White, Jeremy Allen"", ""rank"": 3, ""major"": ""N""}, {""name"": ""persons"", ""value"": ""Monroe, Maika"", ""rank"": 4, ""major"": ""N""}]",2018-10-11T11:00:01+0000,268.0,"Review: In ‘After Everything,’ a Young Love Blooms in Crisis",,,After Everything,,,,By Teo Bugbee,,Review,,,,,nan,nan,nan
https://www.nytimes.com/2018/09/20/movies/quincy-review-quincy-jones.html,"A documentary reveals its octogenarian subject as still busy and productive, and not a little haunted by memories of friends now gone.",The New York Times,"[{""name"": ""creative_works"", ""value"": ""Quincy (Movie)"", ""rank"": 1, ""major"": ""N""}, {""name"": ""persons"", ""value"": ""Jones, Quincy"", ""rank"": 2, ""major"": ""N""}, {""name"": ""persons"", ""value"": ""Jones, Rashida"", ""rank"": 3, ""major"": ""N""}, {""name"": ""persons"", ""value"": ""Hicks, Alan"", ""rank"": 4, ""major"": ""N""}, {""name"": ""subject"", ""value"": ""Documentary Films and Programs"", ""rank"": 5, ""major"": ""N""}, {""name"": ""subject"", ""value"": ""Music"", ""rank"": 6, ""major"": ""N""}, {""name"": ""organizations"", ""value"": ""Netflix Inc"", ""rank"": 7, ""major"": ""N""}]",2018-09-20T14:00:01+0000,460.0,Review: ‘Quincy’ Captures a Lifelong Love Affair With Music,,,The Man Behind the Music,,,,By Glenn Kenny,,Review,,,,,nan,nan,nan
https://www.nytimes.com/2018/09/20/movies/love-gilda-review-saturday-night-live-documentary.html,"Adding to the booming genre of comedian documentaries, this film is an affectionate portrait of one of the first major stars of “Saturday Night Live.”",The New York Times,"[{""name"": ""subject"", ""value"": ""Documentary Films and Programs"", ""rank"": 1, ""major"": ""N""}, {""name"": ""creative_works"", ""value"": ""Love, Gilda (Movie)"", ""rank"": 2, ""major"": ""N""}, {""name"": ""persons"", ""value"": ""Radner, Gilda"", ""rank"": 3, ""major"": ""N""}, {""name"": ""persons"", ""value"": ""D'Apolito, Lisa"", ""rank"": 4, ""major"": ""N""}, {""name"": ""creative_works"", ""value"": ""Saturday Night Live (TV Program)"", ""rank"": 5, ""major"": ""N""}, {""name"": ""subject"", ""value"": ""Television"", ""rank"": 6, ""major"": ""N""}, {""name"": ""subject"", ""value"": ""Comedy and Humor"", ""rank"": 7, ""major"": ""N""}]",2018-09-20T11:00:01+0000,421.0,"Review: In ‘Love, Gilda,’ a Portrait of a Brief and Brilliant Career",,,"Eccentric Charm, Raucous Abandon",,,,By Jason Zinoman,,Review,,,,,nan,nan,nan
https://www.nytimes.com/2018/09/20/movies/tea-with-the-dames-review.html,"This documentary with a simple premise — Eileen Atkins, Judi Dench, Joan Plowright and Maggie Smith in conversation — delivers insight and gossip.",The New York Times,"[{""name"": ""subject"", ""value"": ""Documentary Films and Programs"", ""rank"": 1, ""major"": ""N""}, {""name"": ""creative_works"", ""value"": ""Tea with the Dames (Movie)"", ""rank"": 2, ""major"": ""N""}, {""name"": ""persons"", ""value"": ""Dench, Judi"", ""rank"": 3, ""major"": ""N""}, {""name"": ""persons"", ""value"": ""Smith, Maggie"", ""rank"": 4, ""major"": ""N""}, {""name"": ""persons"", ""value"": ""Plowright, Joan"", ""rank"": 5, ""major"": ""N""}, {""name"": ""persons"", ""value"": ""Hebets, Eileen A"", ""rank"": 6, ""major"": ""N""}, {""name"": ""persons"", ""value"": ""Michell, Roger"", ""rank"": 7, ""major"": ""N""}]",2018-09-20T11:00:01+0000,271.0,"Review: In ‘Tea With the Dames,’ Four Legends Dish on Acting and Love",,,Tea With the Dames,,,,By Glenn Kenny,,Review,,,,,nan,nan,nan
https://www.nytimes.com/2018/09/13/movies/bel-canto-review-julianne-moore.html,Julianne Moore plays an opera singer trapped in a South American mansion in this disappointingly passionless film.,The New York Times,"[{""name"": ""subject"", ""value"": ""Movies"", ""rank"": 1, ""major"": ""N""}, {""name"": ""persons"", ""value"": ""Moore, Julianne"", ""rank"": 2, ""major"": ""N""}, {""name"": ""persons"", ""value"": ""Weitz, Paul"", ""rank"": 3, ""major"": ""N""}, {""name"": ""persons"", ""value"": ""Watanabe, Ken"", ""rank"": 4, ""major"": ""N""}, {""name"": ""creative_works"", ""value"": ""Bel Canto (Movie)"", ""rank"": 5, ""major"": ""N""}]",2018-09-13T11:00:01+0000,464.0,"Review: In ‘Bel Canto,’ Music Is the Food of Love and Rebellion",,,This Hostage Can Hold a Tune,,,,By Jeannette Catsoulis,,Review,,,,,nan,nan,nan
https://www.nytimes.com/2018/07/05/movies/the-citizen-review.html,"This Hungarian film is a careful, compassionate and beautifully acted character drama with a social conscience.",The New York Times,"[{""name"": ""subject"", ""value"": ""Movies"", ""rank"": 1, ""major"": ""N""}, {""name"": ""creative_works"", ""value"": ""The Citizen (Movie)"", ""rank"": 2, ""major"": ""N""}, {""name"": ""persons"", ""value"": ""Vranik, Roland"", ""rank"": 3, ""major"": ""N""}]",2018-07-05T12:00:01+0000,274.0,"Review: In ‘The Citizen,’ an Immigrant Picks a Bad Time to Fall in Love",,,The Citizen,,,,By Glenn Kenny,,Review,,,,,nan,nan,nan
https://www.nytimes.com/2018/06/28/movies/love-cecil-beaton-documentary-review.html,"Lisa Immordino Vreeland’s new documentary is about Cecil Beaton, the British dandy, photographer and theatrical designer.",The New York Times,"[{""name"": ""subject"", ""value"": ""Documentary Films and Programs"", ""rank"": 1, ""major"": ""N""}, {""name"": ""creative_works"", ""value"": ""Love, Cecil (Movie)"", ""rank"": 2, ""major"": ""N""}, {""name"": ""persons"", ""value"": ""Beaton, Cecil"", ""rank"": 3, ""major"": ""N""}, {""name"": ""persons"", ""value"": ""Vreeland, Lisa Immordino"", ""rank"": 4, ""major"": ""N""}]",2018-06-28T11:00:01+0000,293.0,"Review: In ‘Love, Cecil,’ an Aesthete Ahead of His Time",,,"Love, Cecil",,,,By Glenn Kenny,,Review,,,,,nan,nan,nan
https://www.nytimes.com/2018/05/24/movies/how-to-talk-to-girls-at-parties-review.html,John Cameron Mitchell’s loony romantic comedy encourages young love to bloom in the soil of an alien visitation.,The New York Times,"[{""name"": ""subject"", ""value"": ""Movies"", ""rank"": 1, ""major"": ""N""}, {""name"": ""creative_works"", ""value"": ""How to Talk to Girls at Parties (Movie)"", ""rank"": 2, ""major"": ""N""}, {""name"": ""persons"", ""value"": ""Mitchell, John Cameron"", ""rank"": 3, ""major"": ""N""}, {""name"": ""persons"", ""value"": ""Fanning, Elle"", ""rank"": 4, ""major"": ""N""}, {""name"": ""persons"", ""value"": ""Sharp, Alexander"", ""rank"": 5, ""major"": ""N""}]",2018-05-24T11:00:01+0000,458.0,Review: An Alien Teaches a Teenage Punk ‘How to Talk to Girls at Parties’,,,Otherworldly Love in a Punk-Rock World,,,,By Jeannette Catsoulis,,Review,,,,,nan,nan,nan
https://www.nytimes.com/2018/04/26/movies/review-rogers-park.html,Two couples struggle to find serenity as middle age and its multiple discontents come breathing down their necks.,The New York Times,"[{""name"": ""subject"", ""value"": ""Movies"", ""rank"": 1, ""major"": ""N""}, {""name"": ""creative_works"", ""value"": ""Rogers Park (Movie)"", ""rank"": 2, ""major"": ""N""}, {""name"": ""persons"", ""value"": ""Henry, Kyle"", ""rank"": 3, ""major"": ""N""}]",2018-04-26T11:00:10+0000,325.0,"Review: In ‘Rogers Park,’ Life and Love in a Chicago Neighborhood",,,Rogers Park,,,,By Glenn Kenny,,Review,,,,,nan,nan,nan
https://www.nytimes.com/2018/04/26/movies/love-and-bananas-review-asian-elephants.html,"In this personal movie, the actress Ashley Bell embarks on an elephant rescue in Thailand that also reveals the threats to the animal’s survival.",The New York Times,"[{""name"": ""creative_works"", ""value"": ""Love & Bananas: An Elephant Story (Movie)"", ""rank"": 1, ""major"": ""N""}, {""name"": ""persons"", ""value"": ""Bell, Ashley (1986- )"", ""rank"": 2, ""major"": ""N""}, {""name"": ""subject"", ""value"": ""Elephants"", ""rank"": 3, ""major"": ""N""}, {""name"": ""subject"", ""value"": ""Animal Abuse, Rights and Welfare"", ""rank"": 4, ""major"": ""N""}, {""name"": ""subject"", ""value"": ""Documentary Films and Programs"", ""rank"": 5, ""major"": ""N""}]",2018-04-26T11:00:01+0000,254.0,"Review: In ‘Love & Bananas,’ Uncovering the Plight of the Asian Elephant",,,Love &amp; Bananas: An Elephant Story,,,,By Glenn Kenny,,Review,,,,,nan,nan,nan
https://www.nytimes.com/2018/04/18/movies/godard-mon-amour-review.html,A portrait of a filmmaker in crisis that might have worked better as a comedy sketch.,The New York Times,"[{""name"": ""subject"", ""value"": ""Movies"", ""rank"": 1, ""major"": ""N""}, {""name"": ""creative_works"", ""value"": ""Godard Mon Amour (Movie)"", ""rank"": 2, ""major"": ""N""}, {""name"": ""persons"", ""value"": ""Hazanavicius, Michel"", ""rank"": 3, ""major"": ""N""}, {""name"": ""persons"", ""value"": ""Godard, Jean-Luc"", ""rank"": 4, ""major"": ""N""}, {""name"": ""persons"", ""value"": ""Wiazemsky, Anne"", ""rank"": 5, ""major"": ""N""}, {""name"": ""persons"", ""value"": ""Garrel, Louis"", ""rank"": 6, ""major"": ""N""}]",2018-04-18T23:02:46+0000,937.0,"Review: If You Love Godard, You’ll Hate-Watch ‘Godard Mon Amour’",,,"A Portrait and, for Some, a Hate-Watch",,,,By A.O. Scott,,Review,,,,,nan,nan,nan
https://www.nytimes.com/2018/04/12/movies/submergence-review-wim-wenders.html,"In Wim Wenders’s film, Alicia Vikander and James McAvoy are soul mates who find each other before a plotline involving Somali jihadists separates them.",The New York Times,"[{""name"": ""subject"", ""value"": ""Movies"", ""rank"": 1, ""major"": ""N""}, {""name"": ""creative_works"", ""value"": ""Submergence (Movie)"", ""rank"": 2, ""major"": ""N""}, {""name"": ""persons"", ""value"": ""Vikander, Alicia (1988- )"", ""rank"": 3, ""major"": ""N""}, {""name"": ""persons"", ""value"": ""McAvoy, James"", ""rank"": 4, ""major"": ""N""}, {""name"": ""persons"", ""value"": ""Wenders, Wim"", ""rank"": 5, ""major"": ""N""}, {""name"": ""persons"", ""value"": ""Ledgard, J M"", ""rank"": 6, ""major"": ""N""}, {""name"": ""persons"", ""value"": ""Dignam, Erin"", ""rank"": 7, ""major"": ""N""}, {""name"": ""subject"", ""value"": ""Books and Literature"", ""rank"": 8, ""major"": ""N""}]",2018-04-12T11:00:01+0000,591.0,"Review: In ‘Submergence,’ a Love Story Sunk by Geopolitics",,,"They Find Each Other, Then Geopolitics Set In",,,,By Glenn Kenny,,Review,,,,,nan,nan,nan
https://www.nytimes.com/2018/03/29/movies/love-after-love-review.html,Russ Harbaugh’s debut feature delivers something rarely seen in American movies: a warts-and-all examination of extended grief.,The New York Times,"[{""name"": ""subject"", ""value"": ""Movies"", ""rank"": 1, ""major"": ""N""}, {""name"": ""creative_works"", ""value"": ""Love After Love (Movie)"", ""rank"": 2, ""major"": ""N""}, {""name"": ""persons"", ""value"": ""Harbaugh, Russ"", ""rank"": 3, ""major"": ""N""}, {""name"": ""persons"", ""value"": ""MacDowell, Andie"", ""rank"": 4, ""major"": ""N""}]",2018-03-29T11:00:01+0000,280.0,"Review: In ‘Love After Love,’ an Unflinching Look at Extended Grief",,,Love After Love,,,,By Jeannette Catsoulis,,Review,,,,,nan,nan,nan
https://www.nytimes.com/2018/03/29/movies/outside-in-review-jay-duplass-edie-falco.html,Edie Falco and Jay Duplass connect romantically in this life-after-prison drama that prioritizes patience and pragmatism over passion.,The New York Times,"[{""name"": ""subject"", ""value"": ""Movies"", ""rank"": 1, ""major"": ""N""}, {""name"": ""creative_works"", ""value"": ""Outside In (Movie)"", ""rank"": 2, ""major"": ""N""}, {""name"": ""persons"", ""value"": ""Shelton, Lynn"", ""rank"": 3, ""major"": ""N""}, {""name"": ""persons"", ""value"": ""Duplass, Jay"", ""rank"": 4, ""major"": ""N""}, {""name"": ""persons"", ""value"": ""Falco, Edie"", ""rank"": 5, ""major"": ""N""}, {""name"": ""persons"", ""value"": ""Dever, Kaitlyn"", ""rank"": 6, ""major"": ""N""}]",2018-03-29T11:00:01+0000,422.0,Review: On Parole and in Love in ‘Outside In’,,,On Parole and in Love,,,,By Jeannette Catsoulis,,Review,,,,,nan,nan,nan
https://www.nytimes.com/2018/03/15/movies/love-simon-review.html,"This comedy set in a particularly idyllic Atlanta suburb has a gay love story, a blackmailing weasel and surprising emotional resonance.",The New York Times,"[{""name"": ""subject"", ""value"": ""Movies"", ""rank"": 1, ""major"": ""N""}, {""name"": ""creative_works"", ""value"": ""Love, Simon (Movie)"", ""rank"": 2, ""major"": ""N""}, {""name"": ""persons"", ""value"": ""Berlanti, Greg"", ""rank"": 3, ""major"": ""N""}, {""name"": ""persons"", ""value"": ""Robinson, Nick (1995- )"", ""rank"": 4, ""major"": ""N""}]",2018-03-15T17:26:47+0000,272.0,"Review: In ‘Love, Simon,’ a Glossy Teen Romance, the Hero Has a Secret",,,Coming Out Is Complicated,,,,By Glenn Kenny,,Review,,,,,nan,nan,nan
https://www.nytimes.com/2018/03/15/movies/keep-the-change-review.html,"A stubborn thirtysomething sentenced to spend time in an autism support group after an arrest finds romance, in this film starring actors with autism.",The New York Times,"[{""name"": ""subject"", ""value"": ""Movies"", ""rank"": 1, ""major"": ""N""}, {""name"": ""creative_works"", ""value"": ""Keep the Change (Movie)"", ""rank"": 2, ""major"": ""N""}, {""name"": ""persons"", ""value"": ""Israel, Rachel"", ""rank"": 3, ""major"": ""N""}]",2018-03-15T16:10:25+0000,258.0,"Review: In ‘Keep the Change,’ Two People With Autism Find Love",,,Keep the Change,,,,By Glenn Kenny,,Review,,,,,nan,nan,nan
https://www.nytimes.com/2018/02/15/movies/the-party-review-timothy-spall-kristin-scott-thomas.html,Sally Potter directs a very fine cast in a would-be comedy about a calamitously bad evening.,The New York Times,"[{""name"": ""subject"", ""value"": ""Movies"", ""rank"": 1, ""major"": ""N""}, {""name"": ""creative_works"", ""value"": ""The Party (Movie)"", ""rank"": 2, ""major"": ""N""}, {""name"": ""persons"", ""value"": ""Potter, Sally"", ""rank"": 3, ""major"": ""N""}, {""name"": ""persons"", ""value"": ""Spall, Timothy"", ""rank"": 4, ""major"": ""N""}, {""name"": ""persons"", ""value"": ""Scott Thomas, Kristin"", ""rank"": 5, ""major"": ""N""}]",2018-02-15T12:00:25+0000,598.0,Review: A London Night Goes Wrong in ‘The Party’,,,"  Invite Company. Because After All, Misery Loves It.",,,,By Manohla Dargis,,Review,,,,,nan,nan,nan
https://www.nytimes.com/2018/02/15/movies/the-housemaid-review.html,"Set in 1953, when the country was under French colonial rule, the story takes place on a plantation that harbors shameful secrets — and an apparition.",The New York Times,"[{""name"": ""subject"", ""value"": ""Movies"", ""rank"": 1, ""major"": ""N""}, {""name"": ""glocations"", ""value"": ""Vietnam"", ""rank"": 2, ""major"": ""N""}, {""name"": ""persons"", ""value"": ""Nguyen, Derek"", ""rank"": 3, ""major"": ""N""}, {""name"": ""creative_works"", ""value"": ""The Housemaid (Movie)"", ""rank"": 4, ""major"": ""N""}]",2018-02-15T12:00:02+0000,273.0,"Review: In ‘The Housemaid,’ Twisted Love and Angry Ghosts in Vietnam",,,The Housemaid,,,,By Jeannette Catsoulis,,Review,,,,,nan,nan,nan
https://www.nytimes.com/2018/01/19/movies/forever-my-girl-review.html,There are few hard feelings in Bethany Ashton Wolf’s adaptation of a novel by Heidi McLaughlin.,The New York Times,"[{""name"": ""subject"", ""value"": ""Movies"", ""rank"": 1, ""major"": ""N""}, {""name"": ""creative_works"", ""value"": ""Forever My Girl (Movie)"", ""rank"": 2, ""major"": ""N""}, {""name"": ""persons"", ""value"": ""Wolf, Bethany Ashton"", ""rank"": 3, ""major"": ""N""}]",2018-01-19T17:22:06+0000,273.0,"Review: In ‘Forever My Girl,’ a Romance Resumes After a Long Break",,,Hitting  Pause On Love,,,,By Glenn Kenny,,Review,,,,,nan,nan,nan
https://www.nytimes.com/2018/01/18/movies/kangaroo-a-love-hate-story-review.html,"The documentary looks at the mass killings of kangaroos for pet-food companies, leather processors and ranchers in Australia.",The New York Times,"[{""name"": ""creative_works"", ""value"": ""Kangaroo: A Love-Hate Story (Movie)"", ""rank"": 1, ""major"": ""N""}, {""name"": ""subject"", ""value"": ""Kangaroos"", ""rank"": 2, ""major"": ""N""}, {""name"": ""subject"", ""value"": ""Animal Abuse, Rights and Welfare"", ""rank"": 3, ""major"": ""N""}, {""name"": ""persons"", ""value"": ""McIntyre Clere, Kate"", ""rank"": 4, ""major"": ""N""}, {""name"": ""persons"", ""value"": ""McIntyre, Mick"", ""rank"": 5, ""major"": ""N""}, {""name"": ""subject"", ""value"": ""Documentary Films and Programs"", ""rank"": 6, ""major"": ""N""}, {""name"": ""glocations"", ""value"": ""Australia"", ""rank"": 7, ""major"": ""N""}]",2018-01-18T12:00:23+0000,263.0,Review: ‘Kangaroo: A Love-Hate Story’ Exposes a Wildlife Massacre,,,Kangaroo: A Love-Hate Story,,,,By Ken Jaworowski,,Review,,,,,nan,nan,nan
https://www.nytimes.com/2018/01/11/movies/lover-for-a-day-review-philippe-garrel.html,"In Philippe Garrel’s drama, a 23-year-old woman moves in with her father and his 23-year-old girlfriend. Complications ensue.",The New York Times,"[{""name"": ""subject"", ""value"": ""Movies"", ""rank"": 1, ""major"": ""N""}, {""name"": ""creative_works"", ""value"": ""Lover for a Day (Movie)"", ""rank"": 2, ""major"": ""N""}, {""name"": ""persons"", ""value"": ""Garrel, Philippe"", ""rank"": 3, ""major"": ""N""}]",2018-01-11T16:20:53+0000,863.0,Review: A Man and a Woman (and Another Woman) in ‘Lover for a Day’,,,A Love Triangle With Angles That Are Awkward,,,,By Manohla Dargis,,Review,,,,,nan,nan,nan
https://www.nytimes.com/2017/12/14/movies/youth-review.html,This decades-spanning melodrama chronicles the rivalries and heartbreaks of a dance troupe in Mao’s China.,The New York Times,"[{""name"": ""subject"", ""value"": ""Movies"", ""rank"": 1, ""major"": ""N""}, {""name"": ""persons"", ""value"": ""Feng Xiaogang"", ""rank"": 2, ""major"": ""N""}, {""name"": ""creative_works"", ""value"": ""Youth (Movie)"", ""rank"": 3, ""major"": ""N""}]",2017-12-14T12:00:26+0000,267.0,"Review: In ‘Youth,’ the People’s Dance Troupe, in Love and War",,,Youth,,,,By Glenn Kenny,,Review,,,,,nan,nan,nan
https://www.nytimes.com/2017/12/14/movies/killing-for-love-review.html,"The true-crime documentary lays out a persuasive case for reasonable doubt in the case against Jens Soering, who was convicted, along with his girlfriend.",The New York Times,"[{""name"": ""creative_works"", ""value"": ""Killing for Love (Movie)"", ""rank"": 1, ""major"": ""N""}, {""name"": ""persons"", ""value"": ""Soering, Jens"", ""rank"": 2, ""major"": ""N""}, {""name"": ""persons"", ""value"": ""Haysom, Elizabeth"", ""rank"": 3, ""major"": ""N""}, {""name"": ""persons"", ""value"": ""Vetter, Marcus (1967- )"", ""rank"": 4, ""major"": ""N""}, {""name"": ""persons"", ""value"": ""Steinberger, Karin"", ""rank"": 5, ""major"": ""N""}, {""name"": ""subject"", ""value"": ""Documentary Films and Programs"", ""rank"": 6, ""major"": ""N""}, {""name"": ""subject"", ""value"": ""Murders, Attempted Murders and Homicides"", ""rank"": 7, ""major"": ""N""}]",2017-12-14T12:00:26+0000,281.0,Review: ‘Killing for Love’ Revisits a Virginia Murder Case,,,Killing for Love,,,,By Ben Kenigsberg,,Review,,,,,nan,nan,nan
https://www.nytimes.com/2017/11/30/movies/the-shape-of-water-review-guillermo-del-toro.html,"Guillermo del Toro’s latest film is an unlikely and lyrical love story, inspired by “Creature From the Black Lagoon.”",The New York Times,"[{""name"": ""subject"", ""value"": ""Movies"", ""rank"": 1, ""major"": ""N""}, {""name"": ""creative_works"", ""value"": ""The Shape of Water (Movie)"", ""rank"": 2, ""major"": ""N""}, {""name"": ""persons"", ""value"": ""Del Toro, Guillermo"", ""rank"": 3, ""major"": ""N""}, {""name"": ""persons"", ""value"": ""Spencer, Octavia"", ""rank"": 4, ""major"": ""N""}, {""name"": ""persons"", ""value"": ""Shannon, Michael"", ""rank"": 5, ""major"": ""N""}, {""name"": ""persons"", ""value"": ""Hawkins, Sally"", ""rank"": 6, ""major"": ""N""}, {""name"": ""persons"", ""value"": ""Jones, Doug (1960- )"", ""rank"": 7, ""major"": ""N""}]",2017-11-30T16:10:56+0000,924.0,Review: ‘The Shape of Water’ Is Altogether Wonderful,,,A Monster Worthy of Love,,,,By A.O. Scott,,Review,,,,,nan,nan,nan
https://www.nytimes.com/2017/11/30/movies/love-beats-rhymes-azealia-banks-rza.html,"The rap luminary RZA and the hip-hop musician Azealia Banks team up for a story of rap and poetry, “Love Beats Rhymes.”",The New York Times,"[{""name"": ""subject"", ""value"": ""Movies"", ""rank"": 1, ""major"": ""N""}, {""name"": ""subject"", ""value"": ""Rap and Hip-Hop"", ""rank"": 2, ""major"": ""N""}, {""name"": ""persons"", ""value"": ""RZA"", ""rank"": 3, ""major"": ""N""}, {""name"": ""persons"", ""value"": ""Banks, Azealia"", ""rank"": 4, ""major"": ""N""}, {""name"": ""creative_works"", ""value"": ""Love Beats Rhymes (Movie)"", ""rank"": 5, ""major"": ""N""}]",2017-11-30T12:00:05+0000,319.0,"Review: In ‘Love Beats Rhymes,’ a Hip-Hop Artist Transformed by Poetry",,,Love Beats Rhymes,,,,By Glenn Kenny,,Review,,,,,nan,nan,nan
https://www.nytimes.com/2017/11/23/movies/cuba-and-the-cameraman-review.html,The filmmaker Jon Alpert has been visiting and documenting Cuba for 45 years. His new movie looks back fondly at its people and its leader.,The New York Times,"[{""name"": ""subject"", ""value"": ""Documentary Films and Programs"", ""rank"": 1, ""major"": ""N""}, {""name"": ""glocations"", ""value"": ""Cuba"", ""rank"": 2, ""major"": ""N""}, {""name"": ""creative_works"", ""value"": ""Cuba and the Cameraman (Movie)"", ""rank"": 3, ""major"": ""N""}, {""name"": ""persons"", ""value"": ""ALPERT, JON"", ""rank"": 4, ""major"": ""N""}]",2017-11-23T12:00:20+0000,427.0,Review: ‘Cuba and the Cameraman’ Lavishes Love on a Country … and Castro,,,Cuba and the Cameraman,,,,By Glenn Kenny,,Review,,,,,nan,nan,nan
